COLUMNA,DESCRIPCION,TIPO_DATO,LONGITUD,CODIGO_VALIDO
TIPO_DE_DATO,Es la presentación de la información.,varchar,100,"Estimación,Porcentaje,Total,Limite de confianza inferior,Limite de confianza superior,Coeficiente de variacion"
UP_II7,"Unidades de producción con superficie agrícola : Es la unidad de producción que cuenta con un área utilizada  para la siembra o plantación de cultivos anuales o perennes; incluye la superficie en descanso y la no sembrada por cualquier otra causa, en el periodo de referencia. Unidad de medida: Porcentaje",float,10.2,0000000000.00-9999999999.99
UP_II8,"Unidades de producción con superficie de riego : Es la unidad de producción con superficie agrícola y que dispone de agua controlada a través de obras hidráulicas u otros medios hechos por el hombre, sin importar si se regó o no en el periodo de referencia. Unidad de medida: Porcentaje",float,10.2,0000000000.00-9999999999.99
II8_1_1,"Sistema de riego de canales recubiertos o revestidos : Construcción de cemento, lámina o plástico, cuya finalidad es permitir la conducción del agua a los terrenos agrícolas para su riego evitando la pérdida de agua ocasionada por la filtración. Unidad de medida: Porcentaje",float,10.2,0000000000.00-9999999999.99
II8_1_2,Sistema de riego de canales de tierra : Construcción de tierra que se utiliza para la conducción de agua y que carece de un recubrimiento. Unidad de medida: Porcentaje,float,10.2,0000000000.00-9999999999.99
II8_1_3,"Sistema de riego de microaspersión : Mecanismo constituido por tubos o mangueras mediante las cuales el agua es conducida a presión, y por medio de boquillas el agua es atomizada formando una nebulización con la que se riegan los cultivos o plantaciones. Unidad de medida: Porcentaje",float,10.2,0000000000.00-9999999999.99
II8_1_4,Sistema de riego de aspersión : Mecanismo constituido por tubos o mangueras mediante las cuales es conducida el agua a presión permitiendo regar los cultivos o plantaciones por medio de boquillas. Unidad de medida: Porcentaje,float,10.2,0000000000.00-9999999999.99
II8_1_5,Sistema de riego de goteo : Mecanismo constituido por tubos o mangueras mediante las cuales el agua es conducida a presión. Por medio de boquillas gotea el agua a la base de cada uno de los árboles o plantas. Unidad de medida: Porcentaje,float,10.2,0000000000.00-9999999999.99
II8_1_6,"Sistema de riego de otro Sistema : Sistema de riego diferente al de aspersión, microaspersión, por goteo y por gravedad, que se utiliza para proporcionar agua a los cultivos o plantaciones. Unidad de medida: Porcentaje",float,10.2,0000000000.00-9999999999.99
II8_2_1,"Agua negra utilizada : Aguas residuales que provienen, principalmente, de concentraciones urbanas y no han sido sometidas a un proceso de tratamiento. Unidad de medida: Porcentaje",float,10.2,0000000000.00-9999999999.99
II8_2_2,"Agua tratada utilizada : Aguas residuales que provienen, principalmente, de las ciudades y han sido tratadas por medios físicos y químicos en una planta de tratamiento, con el fin de disminuir las substancias tóxicas. Unidad de medida: Porcentaje",float,10.2,0000000000.00-9999999999.99
II8_2_3,"Agua blanca utilizada : Agua de pozos, manantiales, ojos de agua, ríos, lagunas y presas, entre otras fuentes, generalmente con bajo contenido de substancias tóxicas, además de carecer de desechos residuales. Unidad de medida: Porcentaje",float,10.2,0000000000.00-9999999999.99
II8_2_4,"Agua salobre utilizada : Es el agua que tiene más sal disuelta que el agua dulce, pero menos que el agua de mar; es típica de los estuarios (esteros) y resulta de la mezcla del agua del río con el agua del mar. También se encuentra agua salobre de origen fósil en ciertos acuíferos asociados con rocas salinas. Unidad de medida: Porcentaje",float,10.2,0000000000.00-9999999999.99
II8_2_5,No sabe el tipo de agua utilizada : El informante no tiene conocimiento del tipo de agua que se utiliza para regar los cultivos. Unidad de medida: Porcentaje,float,10.2,0000000000.00-9999999999.99
II8_3_1,"Bordo, hoya de agua o jagüey como origen del agua : Construcción consistente en una faja de tierra elevada sobre el terreno, edificada con el propósito de almacenar agua que puede ser utilizada en el riego de los cultivos. El bordo también es conocido como JAGÜEY. Unidad de medida: Porcentaje",float,10.2,0000000000.00-9999999999.99
II8_3_2,"Unidades de producción con superficie de riego con pozo profundo como origen del agua : Es la unidad de producción con superficie de riego y que cuenta con una Excavación vertical, generalmente de sección circular (Pozo profundo), realizada con el propósito de extraer agua del subsuelo por medio de bombeo, la cual es utilizada para el riego de los cultivos. Unidad de medida: Porcentaje",float,10.2,0000000000.00-9999999999.99
II8_3_3,"Pozo a cielo abierto como origen del agua : Excavación poco profunda en el suelo, generalmente de sección circular, que se construye para extracción de agua subterránea, la cual puede ser utilizada para regar los cultivos. Unidad de medida: Porcentaje",float,10.2,0000000000.00-9999999999.99
II8_3_4,"Rio como origen del agua : Corriente natural que es aprovechada para extraer agua, ya sea por gravedad o por bombeo, para el riego de los cultivos Unidad de medida: Porcentaje",float,10.2,0000000000.00-9999999999.99
II8_3_5,"Manantial como origen del agua : Fuente natural de agua que brota de la tierra o entre las rocas, y que puede ser permanente o temporal, la cual entre otros, es aprovechada para el riego de los cultivos. Unidad de medida: Porcentaje",float,10.2,0000000000.00-9999999999.99
II8_3_6,"Presa como origen del agua : Construcción de amplias dimensiones edificada con el propósito de almacenar grandes volúmenes de agua, la cual puede ser utilizada en el riego de los cultivos. Unidad de medida: Porcentaje",float,10.2,0000000000.00-9999999999.99
II8_3_7,"Otra fuente como origen del agua : Fuentes de agua diferentes a las mencionadas anteriormente, y de las cuales se obtiene agua para riego; como: lago, laguna, estanque, pila, represa y reservorio, entre otras. Unidad de medida: Porcentaje",float,10.2,0000000000.00-9999999999.99
UP_II7_ACT_AGRI,"Unidades de producción con actividad agrícola : Es la unidad de producción en la cual se realiza la actividad relacionada con el aprovechamiento de especies vegetales cultivadas a cielo abierto o en agricultura protegida, con el fin de obtener alimentos para consumo humano y animal, así como para suministrar materias primas a la industria. Incluye la producción de plantas ornamentales. Unidad de medida: Porcentaje",float,10.2,0000000000.00-9999999999.99
UP_III19_TEC_AGRI,"Unidades de producción con actividad agrícola que utilizaron alguna tecnología : Es la unidad de producción en la cual se realiza una actividad agrícola y en la cual se aplican un conjunto de conocimientos, prácticos y técnicos que se aprovechan en la agricultura a cielo abierto para mejorar la cantidad y calidad de la producción, en el periodo de referencia. Unidad de medida: Porcentaje",float,10.2,0000000000.00-9999999999.99
III19_1,"Fertilizantes quimicos : Productos de origen industrial que son aplicados directamente al suelo, a través del riego o por aspersión a las hojas, con el fin de proporcionar nutrientes a los cultivos o plantaciones para favorecer su desarrollo y aumentar su productividad. Unidad de medida: Porcentaje",float,10.2,0000000000.00-9999999999.99
III19_2,"Biofertilizantes : Organismos vivos que son usados en agricultura como fertilizantes de las plantas. Su uso está muy extendido en agricultura ecológica, al no poder utilizar en ella fertilizantes inorgánicos. Su principal ventaja es ser un tipo de fertilizantes naturales, respetuosos con el medio ambiente, no contaminantes. Los biofertilizantes son preparaciones que contienen microorganismos que existen naturalmente en los suelos agrícolas, pero que han sido seleccionados o modificados genéticamente para mejorar la condición física de los suelos; para hacer disponibles a las plantas nutrientes que no lo están bajo condiciones normales; o, para que actúen como reguladores o estimuladores del crecimiento y, a través de ello, aumenten el rendimiento y/o la calidad de los cultivos. Unidad de medida: Porcentaje",float,10.2,0000000000.00-9999999999.99
III19_3,"Abonos naturales : Materia orgánica de origen animal o vegetal que se incorpora al suelo, con el fin de aumentar la fertilidad de la tierra, mejorar la textura del suelo y favorecer el desarrollo de las plantas. Ejemplo: estiércol, composta, abonos verdes, gallinaza, entre otros. Unidad de medida: Porcentaje",float,10.2,0000000000.00-9999999999.99
III19_4,"Semilla criolla : Es la semilla encontrada en su estado silvestre o natural, que es utilizada por la agricultura de subsistencia y tradicional. Se caracteriza por la siembra de pequeñas parcelas, con escasa utilización de fertilizantes y plaguicidas, y donde el destino final de la producción es el autoconsumo. Unidad de medida: Porcentaje",float,10.2,0000000000.00-9999999999.99
III19_5,"Semilla mejorada : Semilla que ha sido modificada, con el fin de aumentar la resistencia a enfermedades, plagas, sequías, así como incrementar su capacidad productiva u obtener alguna otra característica deseable. Se incluyen las semillas híbridas y todas aquellas tratadas, seleccionadas y envasadas por casas comerciales. Unidad de medida: Porcentaje",float,10.2,0000000000.00-9999999999.99
III19_6,"Semilla modificada o transgénica : Semilla que ha sido cambiada genéticamente en laboratorio y cuyo fin es modificar su información a nivel celular para ser más resistentes a plagas y enfermedades, aumentando así la producción agrícola Unidad de medida: Porcentaje",float,10.2,0000000000.00-9999999999.99
III19_7_1,"Herbicidas químicos : Productos o sustancias químicas que se aplican para combatir, controlar o evitar el desarrollo de malezas, insectos u otro tipo de plagas que atacan a los cultivos. En este concepto quedan incluidos todos los productos químicos comprados o los de elaboración propia que se aplican directamente a las plantas, al suelo, o mediante el agua de riego. Unidad de medida: Porcentaje",float,10.2,0000000000.00-9999999999.99
III19_7_2,"Herbicidas orgánicos : Productos o sustancias de origen natural que se aplican para combatir, controlar o evitar el desarrollo de malezas, insectos, hongos, arañas u otro tipo de plagas que atacan a los cultivos, como pueden ser: tabaco, cebolla, ajo, entre otros. Unidad de medida: Porcentaje",float,10.2,0000000000.00-9999999999.99
III19_8_1,"Insecticidas químicos : Productos o sustancias químicas que se aplican para combatir, controlar o evitar el desarrollo de malezas, insectos u otro tipo de plagas que atacan a los cultivos. En este concepto quedan incluidos todos los productos químicos comprados o los de elaboración propia que se aplican directamente a las plantas, al suelo, o mediante el agua de riego. Unidad de medida: Porcentaje",float,10.2,0000000000.00-9999999999.99
III19_8_2,"Insecticidas orgánicos : Productos o sustancias de origen natural que se aplican para combatir, controlar o evitar el desarrollo de malezas, insectos, hongos, arañas u otro tipo de plagas que atacan a los cultivos, como pueden ser: tabaco, cebolla, ajo, entre otros. Unidad de medida: Porcentaje",float,10.2,0000000000.00-9999999999.99
III19_9,Sensores de humedad : El sensor de humedad es un aparato o artefacto que determina el grado de humedad del suelo. En la agricultura es necesario conocer el grado de humedad del suelo con el fin de manejar un sistema de riego adecuado. Se denomina humedad del suelo a la cantidad de agua por volumen de tierra que hay en un terreno. Unidad de medida: Porcentaje,float,10.2,0000000000.00-9999999999.99
III19_10,"Sensor de nutrición (Green Seeker) : Equipo que da una respuesta básica y rápida a las necesidades de nutrientes, a la condición del cultivo, al rendimiento potencial y disminuye costos de producción, ayudando a los agricultores a aplicar la cantidad exacta de nitrógeno en el lugar correcto en el momento oportuno, reduciendo el gasto de este insumo. Estos datos pueden ser usados en conjunto con otra información agronómica para catalogar una respuesta básica a: nutrientes, condición del cultivo, rendimiento potencial, estrés, entre otras. Actualmente, este sistema puede utilizarse para los cultivos de trigo y maíz, pero los investigadores ya están desarrollando los algoritmos para poder utilizarlo en papa, canola, algodón, césped, yuca, cebada y girasol. Unidad de medida: Porcentaje",float,10.2,0000000000.00-9999999999.99
III19_11,"Animales de tiro o yunta : Especies animales que se utilizan para jalar o tirar carretas, implementos agrícolas o para carga, como pueden ser: bueyes, mulas, caballos o burros. Unidad de medida: Porcentaje",float,10.2,0000000000.00-9999999999.99
III19_12,"Tractor : Vehículo automotor de características especiales, cuya capacidad de tracción o arrastre permite accionar diferentes implementos y accesorios utilizados en las actividades agrícolas, ganaderas o forestales. Unidad de medida: Porcentaje",float,10.2,0000000000.00-9999999999.99
III19_13,"Sembradoras o cosechadoras : Implemento destinado para sembrar y cuyo motor solía ser un malacate arrastrado por caballerías, en la actualidad lo frecuente es obtener potencia de un tractor. La mayoría de estos implementos llevan unas rejas delante de los tubos por los cuales se distribuyen los granos, que van abriendo el surco en que se depositan, y rastros, rodillos o gradas que los cubren luego de tierra.  COSECHADORA: Máquina dedicada a realizar labores de recolección de productos agrícolas, como arroz, maíz, trigo, cebada y otros, aunque también puede recolectar oleaginosas y otros cultivos tales como algodón o productos forestales. En sus comienzos, esta máquina era accionada por un tractor y servía para cosechar en el sentido de cortar el cultivo, que posteriormente era procesado por otros medios para extraer los granos, proceso denominado trilla o trillado. Actualmente es estándar que realice ambas operaciones y que sea autopropulsada. Unidad de medida: Porcentaje",float,10.2,0000000000.00-9999999999.99
III19_14_1,"Control biológico de plagas : Empleo de insectos benéficos como avispas, pulgones, moscas, palomilla, campamocha, entre otros, que atacan malezas y plagas que afectan a los cultivos o plantaciones. Unidad de medida: Porcentaje",float,10.2,0000000000.00-9999999999.99
III19_14_2,Injerto de árboles : Árbol frutal al que se le ha incorporado trozos de tallo o yemas de otra variedad para que el árbol injertado obtenga las características deseadas. Unidad de medida: Porcentaje,float,10.2,0000000000.00-9999999999.99
III19_14_3,"Rotación de cultivos : Cambio sistemático de un cultivo a otro, que se lleva a cabo periódicamente, con el fin de recuperar los nutrientes del suelo. Unidad de medida: Porcentaje",float,10.2,0000000000.00-9999999999.99
III19_14_4,"Podas : Corte de algunas ramas de los árboles frutales, con la finalidad de permitir la entrada de luz y aire a los frutos, además de eliminar ramas enfermas. Existen diferentes tipos de poda, como son: de sanidad, de formación y de rejuvenecimiento, entre otras. Unidad de medida: Porcentaje",float,10.2,0000000000.00-9999999999.99
III19_14_5,Quemas controladas : Eliminación de malezas mediante fuego controlado con la utilización de equipo especializado y bajo supervisión constante. Unidad de medida: Porcentaje,float,10.2,0000000000.00-9999999999.99
III19_14_6,"Labranza de conservación : Es aquella que usa los residuos de las cosechas (rastrojos) contribuyendo de manera esencial a conservar y rehabilitar el suelo, a incorporar materia orgánica, a mejorar la fertilidad del suelo y a reducir los costos de producción, con lo que los productores pueden practicar una agricultura sustentable. También se incluyen las técnicas de labranza cero y permacultura que consisten en mantener una cubierta orgánica permanente o semipermanente del suelo (por ejemplo, un cultivo en crecimiento o una capa de rastrojo) para protegerlo del sol, la lluvia y el viento, y permitir que los microorganismos y la fauna del suelo se ocupen de "arar" y mantengan el equilibrio de los elementos nutritivos, procesos naturales que el arado mecánico perjudica. Unidad de medida: Porcentaje",float,10.2,0000000000.00-9999999999.99
III19_15,Recepción asistencia técnica : Orientación que recibe el productor por parte de personal especializado para la utilización de técnicas o procedimientos con el propósito de mejorar la producción agrícola. Unidad de medida: Porcentaje,float,10.2,0000000000.00-9999999999.99
III19_16,"Certificado para agricultura orgánica : Documento oficial en el que se hace constar por escrito por una autoridad competente, que el productor practica la agricultura orgánica (también denominada ecológica o biológica), el cual es un sistema de explotación agrícola autónoma basada en la utilización óptima de los recursos naturales, sin emplear productos químicos sintéticos u organismos genéticamente modificados (OGMs) -ni para abono ni para combatir las plagas-, logrando de esta forma obtener alimentos orgánicos a la vez que se conserva la fertilidad de la tierra y se respeta el medio ambiente. Todo ello de manera sostenible y equilibrada. Unidad de medida: Porcentaje",float,10.2,0000000000.00-9999999999.99
III19_17,"Otra tecnología : Son prácticas o técnicas diferentes a las anteriores como: uso de fungicidas, acaricidas, agricultura orgánica, cultivo de tejidos, entre otras, que se realizan en la unidad de producción. Unidad de medida: Porcentaje",float,10.2,0000000000.00-9999999999.99
III20_1,"Semilla para siembra : Semilla escogida, generalmente de la última cosecha, cuyas características físicas se pretenden reproducir en la siembra del siguiente ciclo. Unidad de medida: Porcentaje",float,10.2,0000000000.00-9999999999.99
III20_2_TODO,Destinan todo para consumo familiar : Es el volumen de la producción que se destina para alimentación de la familia del productor. Unidad de medida: Porcentaje,float,10.2,0000000000.00-9999999999.99
III20_2_UNA_PARTE,Destinan una parte para consumo familiar : Es el volumen de la producción que se destina para alimentación de la familia del productor. Unidad de medida: Porcentaje,float,10.2,0000000000.00-9999999999.99
III20_2_NADA,No destinan nada para consumo familiar : Es el volumen de la producción que se destina para alimentación de la familia del productor. Unidad de medida: Porcentaje,float,10.2,0000000000.00-9999999999.99
III20_3_TODO,Destinan todo para consumo ganadero : Es el volumen de la producción que se destina para la alimentación del ganado del productor. Unidad de medida: Porcentaje,float,10.2,0000000000.00-9999999999.99
III20_3_UNA_PARTE,Destinan una parte para consumo ganadero : Es el volumen de la producción que se destina para la alimentación del ganado del productor. Unidad de medida: Porcentaje,float,10.2,0000000000.00-9999999999.99
III20_3_NADA,No destinan nada para consumo ganadero : Es el volumen de la producción que se destina para la alimentación del ganado del productor. Unidad de medida: Porcentaje,float,10.2,0000000000.00-9999999999.99
III21_1_1,Directamente al consumidor : Es la comercialización de los productos agrícolas realizada directamente a una persona física o empresa para procesarlos o emplearlos conforme a su conveniencia. Unidad de medida: Porcentaje,float,10.2,0000000000.00-9999999999.99
III21_1_2,"Mayorista : Es la comercialización de los productos agrícolas a una persona que se dedica a comprar grandes volúmenes de productos agrícolas, los cuales posteriormente venderá sin transformar o procesar. Unidad de medida: Porcentaje",float,10.2,0000000000.00-9999999999.99
III21_1_3,"Intermediario : Es la comercialización de los productos agrícolas sin transformar o procesar a una persona física o empresa, a través de una persona que se encarga oficiosamente de hacer los trámites, mediante un pago. Unidad de medida: Porcentaje",float,10.2,0000000000.00-9999999999.99
III21_1_4,"Otro país : Es la comercialización de productos agrícolas que el productor vende de manera directa (sin intermediarios) a residentes en el exterior, conforme a las Leyes y Normas establecidas en el comercio internacional. Unidad de medida: Porcentaje",float,10.2,0000000000.00-9999999999.99
III21_1_5,Otro tipo de comprador : Es la comercialización de los productos agrícolas a una persona física o empresa diferente a los considerados en las opciones anteriores. Unidad de medida: Porcentaje,float,10.2,0000000000.00-9999999999.99
ESTATUS,"Descripción de estatus de los datos.El estatus de la información puede ser : Cifras Definitivas, Cifras Revisadas, Cifras Preliminares.",varchar,100,Cifras Definitivas
