COLUMNA,DESCRIPCION,TIPO_DATO,LONGITUD,CODIGO_VALIDO
UP_IX47,"Unidades de producción que utilizaron alguna de las  tecnologías : Son aquellas que en el periodo de referencia,  el productor reportó haber utilizado alguna de las tecnologías agropecuarias tales como: inseminación artificial, utilización de fertilizantes, utilización de insecticidas o herbicidas, vacunación, aplicación de hormonales, entre otras. Unidad de medida: Porcentaje",float,10.2,0000000000.00-9999999999.99
IX47_1,"Computadora : Uso de máquina electrónica que recibe y procesa datos para convertirlos en información útil, que el productor utiliza para el desarrollo de las actividades agropecuarias. Unidad de medida: Porcentaje",float,10.2,0000000000.00-9999999999.99
IX47_2,"Internet : Uso de redes de información ya sea para investigación o transmisión de información, que el productor utiliza para el desarrollo de las actividades agropecuarias. Unidad de medida: Porcentaje",float,10.2,0000000000.00-9999999999.99
IX47_3,"Teléfono celular : Uso de un dispositivo de comunicación electrónico con las mismas capacidades básicas de un teléfono de línea convencional. Además de ser portátil, es inalámbrico al no requerir cables conductores para su conexión a la red telefónica, que el productor utiliza para el desarrollo de las actividades agropecuarias. Unidad de medida: Porcentaje",float,10.2,0000000000.00-9999999999.99
ESTATUS,"Descripción de estatus de los datos.El estatus de la información puede ser : Cifras Definitivas, Cifras Revisadas, Cifras Preliminares.",varchar,100,Cifras Definitivas
