COLUMNA,DESCRIPCION,TIPO_DATO,LONGITUD,CODIGO_VALIDO
ENTIDAD,Nombre de la  Entidad.,varchar,100,"Aguascalientes a Zacatecas,Nacional"
CULTIVO,"Especie vegetal que se aprovecha para consumo humano o animal. Se clasifican en: Cultivos anuales cuyo periodo de desarrollo, desde la siembra hasta la cosecha, es menor o igual a un año; Dependiendo de la fecha de siembra, los cultivos anuales se clasifican en cultivos de primavera-verano (marzo-septiembre) o de otoño-invierno (octubre-febrero). Cultivos perennes desde la plantación hasta la maduración del fruto, es mayor a un año, independientemente del número de cosechas o cortes que se realicen durante su ciclo vegetativo.",varchar,255,"Superficie sembrada de Algodón, Superficie sembrada de Avena forrajera, Superficie sembrada de Cebada, Superficie sembrada de Cebolla, Superficie sembrada de Chile, Superficie sembrada de Frijol, Superficie sembrada de Jitomate, Superficie sembrada de Maíz grano, Superficie sembrada de Melón y sandía, Superficie sembrada de Sorgo grano, Superficie sembrada de Trigo grano, Superficie plantada de Alfalfa, Superficie plantada de Café, Superficie plantada de Caña de azúcar, Superficie plantada de Limón, Superficie plantada de Mango, Superficie plantada de Naranja, Superficie plantada de Pastos, Superficie plantada de Plátano, Superficie cosechada de Algodón, Superficie cosechada de Avena forrajera, Superficie cosechada de Cebada, Superficie cosechada de Cebolla, Superficie cosechada de Chile, Superficie cosechada de Frijol, Superficie cosechada de Jitomate, Superficie cosechada de Maíz grano, Superficie cosechada de Melón y sandía, Superficie cosechada de Sorgo grano, Superficie cosechada de Trigo grano, Superficie cosechada de Alfalfa, Superficie cosechada de Café, Superficie cosechada de Caña de azúcar, Superficie cosechada de Limón, Superficie cosechada de Mango, Superficie cosechada de Naranja, Superficie cosechada de Pastos, Superficie cosechada de Plátano, Producción de Algodón, Producción de Avena forrajera, Producción de Cebada, Producción de Cebolla, Producción de Chile, Producción de Frijol, Producción de Jitomate, Producción de Maíz grano, Producción de Melón y sandía, Producción de Sorgo grano, Producción de Trigo grano, Producción de Alfalfa, Producción de Café, Producción de Caña de azúcar, Producción de Limón, Producción de Mango, Producción de Naranja, Producción de Pastos, Producción de Plátano."
ESTIMACION,"Dato generado a partir de la aplicación de los factores de expansión a los resultados obtenidos de los elementos de la muestra, con el propósito de dar representatividad aproximada a parámetros de la población bajo estudio.",float,10.2,0000000000.00-9999999999.99
LIMITE_DE_CONFIANZA_INFERIOR,Valor mínimo del intervalo de confianza para la estimación de un parámetro poblacional.,float,10.2,0000000000.00-9999999999.99
LIMITE_DE_CONFIANZA_SUPERIOR,Valor máximo del intervalo de confianza para la estimación de un parámetro poblacional.,float,10.2,0000000000.00-9999999999.99
COEFICIENTE_DE_VARIACION,"Relación entre la desviación estándar de una muestra y su media aritmética, que se establece con la finalidad de encontrar la dispersión relativa.",float,10.2,0000000000.00-9999999999.99
ESTATUS,"Descripción de estatus de los datos.El estatus de la información puede ser : Cifras Definitivas, Cifras Revisadas, Cifras Preliminares.",varchar,100,Cifras Definitivas
