COLUMNA,DESCRIPCION,TIPO_DATO,LONGITUD,CODIGO_VALIDO
TIPO_DE_DATO,Es la presentación de la información.,varchar,100,"Estimación,Porcentaje,Total,Limite de confianza inferior,Limite de confianza superior,Coeficiente de variacion"
V38_HASTA_5_AÑOS,Tractores hasta 5 años :Cantidad de años que ha sido usado el tractor o maquinaria desde su compra inicial. Unidad de medida: Porcentaje,float,10.2,0000000000.00-9999999999.99
V38_MAS_5_A_10_AÑOS,Tractores de 5 hasta 10 años :Cantidad de años que ha sido usado el tractor o maquinaria desde su compra inicial. Unidad de medida: Porcentaje,float,10.2,0000000000.00-9999999999.99
V38_MAS_10_A_15_AÑOS,Tractores de 10 hasta 15 años :Cantidad de años que ha sido usado el tractor o maquinaria desde su compra inicial. Unidad de medida: Porcentaje,float,10.2,0000000000.00-9999999999.99
V38_MAS_15_AÑOS,Tractores de 15 años :Cantidad de años que ha sido usado el tractor o maquinaria desde su compra inicial. Unidad de medida: Porcentaje,float,10.2,0000000000.00-9999999999.99
V38_NO_ESPECIFICADO,Tractores no especificado de años :El informante no tiene conocimiento de los años de uso que tiene el tractor. Unidad de medida: Porcentaje,float,10.2,0000000000.00-9999999999.99
V38_FUN_HASTA_5_AÑOS,Tractores funcionando hasta 5 años :Cantidad de años que ha sido usado el tractor o maquinaria desde su compra inicial. Unidad de medida: Porcentaje,float,10.2,0000000000.00-9999999999.99
V38_FUN_MAS_5_A_10_AÑOS,Tractores funcionando de 5 hasta 10 años :Cantidad de años que ha sido usado el tractor o maquinaria desde su compra inicial. Unidad de medida: Porcentaje,float,10.2,0000000000.00-9999999999.99
V38_FUN_MAS_10_A_15_AÑOS,Tractores funcionando de 10 hasta 15 años :Cantidad de años que ha sido usado el tractor o maquinaria desde su compra inicial. Unidad de medida: Porcentaje,float,10.2,0000000000.00-9999999999.99
V38_FUN_MAS_15_AÑOS,Tractores funcionando de 15 años :Cantidad de años que ha sido usado el tractor o maquinaria desde su compra inicial. Unidad de medida: Porcentaje,float,10.2,0000000000.00-9999999999.99
V38_FUN_NO_ESPECIFICADO,Tractores funcionando no especificado :El informante no tiene conocimiento de los años de uso que tiene el tractor. Unidad de medida: Porcentaje,float,10.2,0000000000.00-9999999999.99
V39_TRILL_HASTA_5_AÑOS,Trilladoras hasta 5 años :Cantidad de años que ha sido usado el tractor o maquinaria desde su compra inicial. Unidad de medida: Porcentaje,float,10.2,0000000000.00-9999999999.99
V39_TRIL_MAS_5_A_10_AÑOS,Trilladoras de 5 hasta 10 años :Cantidad de años que ha sido usado el tractor o maquinaria desde su compra inicial. Unidad de medida: Porcentaje,float,10.2,0000000000.00-9999999999.99
V39_TRIL_MAS_10_AÑOS,Trilladoras mas 10 años :Número de años que tiene de uso la maquinaria. Unidad de medida: Porcentaje,float,10.2,0000000000.00-9999999999.99
V39_TRIL_NO_ESPECIFICADO,Trilladoras no especificado de años :El informante no tiene conocimiento de los años de uso que tiene el tractor. Unidad de medida: Porcentaje,float,10.2,0000000000.00-9999999999.99
V39_SEMB_HASTA_5_AÑOS,Sembradoras de precision hasta 5 años :Cantidad de años que ha sido usado el tractor o maquinaria desde su compra inicial. Unidad de medida: Porcentaje,float,10.2,0000000000.00-9999999999.99
V39_SEMB_MAS_5_A_10_AÑOS,Sembradoras de precision de 5 hasta 10 años :Cantidad de años que ha sido usado el tractor o maquinaria desde su compra inicial. Unidad de medida: Porcentaje,float,10.2,0000000000.00-9999999999.99
V39_SEMB_MAS_10_AÑOS,Sembradoras de precision mas 10 años :Número de años que tiene de uso la maquinaria. Unidad de medida: Porcentaje,float,10.2,0000000000.00-9999999999.99
V39_SEMB_NO_ESPECIFICADO,Sembradoras de precision no especificado :El informante no tiene conocimiento de los años de uso que tiene el tractor. Unidad de medida: Porcentaje,float,10.2,0000000000.00-9999999999.99
VIII46_1_A_HOMBRES,"Familiares sin salario : Cantidad de personas que tienen parentesco con el productor y colaboran en las actividades agrícolas, ganaderas o forestales, efectuadas en la unidad de producción sin recibir sueldo o salario. Unidad de medida: Porcentaje",float,10.2,0000000000.00-9999999999.99
VIII46_2_A_HOMBRES,"Familiares con salario : Cantidad de personas que mediante un acuerdo, ya sea oral o escrito, se comprometen a trabajar durante un tiempo determinado, en la unidad de producción, a cambio de un pago previamente acordado, el cual puede ser en especie o efectivo. Unidad de medida: Porcentaje",float,10.2,0000000000.00-9999999999.99
VIII46_3_A_HOMBRES,"Personal contratado por seis meses o más : Cantidad de personas que mediante un acuerdo, ya sea oral o escrito, se comprometen a trabajar durante un tiempo determinado, en la unidad de producción, a cambio de un pago previamente acordado, el cual puede ser en especie o efectivo. Unidad de medida: Porcentaje",float,10.2,0000000000.00-9999999999.99
VIII46_5_A_HOMBRES,"Personal contratado por menos de seis meses : Cantidad de personas contratadas con permanencia menor a seis meses para la realización de las actividades agrícolas, ganaderas o forestales, que cobran un salario como jornal, es decir, por jornada de trabajo, la cual generalmente se mide por el numero de día trabajados (en la mayoría de los casos cobran por día). Es tan precario su empleo que solamente les pagan los días realmente trabajados, porque quizás al siguiente sus manos ya no sean necesarias. Unidad de medida: Porcentaje",float,10.2,0000000000.00-9999999999.99
VIII46_1_B,"MUJERES_FAMILIARES_SIN_SALARIO : Cantidad de personas que tienen parentesco con el productor y colaboran en las actividades agrícolas, ganaderas o forestales, efectuadas en la unidad de producción sin recibir sueldo o salario. Unidad de medida: Porcentaje",float,10.2,0000000000.00-9999999999.99
VIII46_2_B,"MUJERES_FAMILIARES_CON_SALARIO : Cantidad de personas que mediante un acuerdo, ya sea oral o escrito, se comprometen a trabajar durante un tiempo determinado, en la unidad de producción, a cambio de un pago previamente acordado, el cual puede ser en especie o efectivo. Unidad de medida: Porcentaje",float,10.2,0000000000.00-9999999999.99
VIII46_3_B,"MUJERES_PERSONAL_CONTRATADO_POR_SEIS_MESES_O_MAS : Cantidad de personas que mediante un acuerdo, ya sea oral o escrito, se comprometen a trabajar durante un tiempo determinado, en la unidad de producción, a cambio de un pago previamente acordado, el cual puede ser en especie o efectivo. Unidad de medida: Porcentaje",float,10.2,0000000000.00-9999999999.99
VIII46_5_B,"MUJERES_PERSONAL_CONTRATADO_POR_MENOS_DE_SEIS_MESES : Cantidad de personas contratadas con permanencia menor a seis meses para la realización de las actividades agrícolas, ganaderas o forestales, que cobran un salario como jornal, es decir, por jornada de trabajo, la cual generalmente se mide por el numero de día trabajados (en la mayoría de los casos cobran por día). Es tan precario su empleo que solamente les pagan los días realmente trabajados, porque quizás al siguiente sus manos ya no sean necesarias. Unidad de medida: Porcentaje",float,10.2,0000000000.00-9999999999.99
UP_VI40_1_1,"UP_QUE_OBTUVIERON_CREDITO : Cantidad de dinero o de insumos que se debe a una persona física o empresa denominada acreedor, a cambio de un  compromiso de pago a futuro por el mismo valor recibido, generalmente incluye el pago de intereses. Unidad de medida: Porcentaje",float,10.2,0000000000.00-9999999999.99
VI40_2_HASTA_10_P,"Tasa de interés de hasta del 10 % : Es el porcentaje que se cobra como interés por una suma determinada, es decir, es el precio que se paga por el uso del dinero. Unidad de medida: Porcentaje",float,10.2,0000000000.00-9999999999.99
VI40_2_MAS_10_A_15_P,"Tasa de interés de más del 10 al 15 % : Es el porcentaje que se cobra como interés por una suma determinada, es decir, es el precio que se paga por el uso del dinero. Unidad de medida: Porcentaje",float,10.2,0000000000.00-9999999999.99
VI40_2_MAS_15_A_20_P,"Tasa de interés de más del 15 al 20 % : Es el porcentaje que se cobra como interés por una suma determinada, es decir, es el precio que se paga por el uso del dinero. Unidad de medida: Porcentaje",float,10.2,0000000000.00-9999999999.99
VI40_2_MAS_20_A_25_P,"Tasa de interés de más del 20 al 25 % : Es el porcentaje que se cobra como interés por una suma determinada, es decir, es el precio que se paga por el uso del dinero. Unidad de medida: Porcentaje",float,10.2,0000000000.00-9999999999.99
VI40_2_MAS_25_P,"Tasa de interés mayor del 25 % : Es el porcentaje que se cobra como interés por una suma determinada, es decir, es el precio que se paga por el uso del dinero. Unidad de medida: Porcentaje",float,10.2,0000000000.00-9999999999.99
VI40_2AB_C,"No sabe la tasa de interés : Es aquella que para el desarrollo de las actividades recibe dinero o insumos, en el periodo de referencia, pudiendo ser proporcionado por una persona, física o moral, denominada acreedor, por una empresa, banco, negocio, etc., a cambio del pago por el mismo valor recibido, y generalmente el pago de intereses acordados, desconocidos en ese momento. Unidad de medida: Porcentaje",float,10.2,0000000000.00-9999999999.99
VI40_2AB_1_AÑO,Plazo de pago a un año : Total de años que le otorgaron el crédito. Unidad de medida: Porcentaje,float,10.2,0000000000.00-9999999999.99
VI40_2AB_2_AÑOS,Plazo de pago a dos años : Total de años que le otorgaron el crédito. Unidad de medida: Porcentaje,float,10.2,0000000000.00-9999999999.99
VI40_2AB_3_AÑOS,Plazo de pago a tres años : Total de años que le otorgaron el crédito. Unidad de medida: Porcentaje,float,10.2,0000000000.00-9999999999.99
VI40_2AB_4_AÑOS,Plazo de pago a cuatro años : Total de años que le otorgaron el crédito. Unidad de medida: Porcentaje,float,10.2,0000000000.00-9999999999.99
VI40_2AB_5_AÑOS,Plazo de pago a cinco años : Total de años que le otorgaron el crédito. Unidad de medida: Porcentaje,float,10.2,0000000000.00-9999999999.99
VI40_2AB_MAS_5_AÑOS,Plazo de pago de más de cinco años : Total de años que le otorgaron el crédito. Unidad de medida: Porcentaje,float,10.2,0000000000.00-9999999999.99
VI40_4_1,"Banca comercial  : Institución financiera privada que, entre sus diversos servicios, otorga crédito para el financiamiento de la producción agrícola, ganadera o forestal. Unidad de medida: Porcentaje",float,10.2,0000000000.00-9999999999.99
VI40_4_2,"Sofol : Por sus siglas: Sociedad Financiera de Objeto Limitado. La SOFOL es una sociedad anónima especializada en el otorgamiento de créditos a una sola actividad o sector económico, por ejemplo: SOFOLES especializadas en préstamos hipotecarios o SOFOLES especializadas en actividades agrícolas y pecuarias, entre otras. Las dos grandes diferencias contra los bancos son que estas instituciones no tienen la posibilidad de captar recursos del público en forma de depósitos y cuentas de ahorro, y están especializadas en otorgar créditos a solamente una actividad económica. Unidad de medida: Porcentaje",float,10.2,0000000000.00-9999999999.99
VI40_4_3,Sofom  : Por sus siglas: Sociedad Financiera de Objeto Múltiple. La SOFOM es una sociedad cuyo objetivo principal es el otorgamiento de crédito y/o la celebración de arrendamiento financiero y/o de factoraje financiero conforme a la Ley; no requiere la autorización de las autoridades financieras. Es el cambio de la naturaleza de la SOFOL; esto quiere decir que siguen sin la posibilidad de captar recursos del público general pero ahora pueden otorgar todo tipo de créditos. Unidad de medida: Porcentaje,float,10.2,0000000000.00-9999999999.99
VI40_4_4,"Unión de crédito : Es una entidad financiera auxiliar de crédito, autorizada y regulada por la Comisión Nacional Bancaria y de Valores, constituida como Sociedad Anónima de Capital Variable y que tiene como objetivo servir a sus socios como medio para la obtención y canalización de recursos financieros, satisfacer sus necesidades productivas y hacer más eficientes sus procesos de organización y administración. Unidad de medida: Porcentaje",float,10.2,0000000000.00-9999999999.99
VI40_4_5,"Financiera rural : Es una banca de desarrollo rural del Gobierno Federal que tiene como objetivo crear un sistema financiero rural de acceso al crédito, contribuyendo al fortalecimiento de la agricultura y la ganadería, así como de las diversas actividades vinculadas con el medio rural. Unidad de medida: Porcentaje",float,10.2,0000000000.00-9999999999.99
VI40_4_6,"Caja de ahorro popular  : Es una entidad financiera de carácter benéfico y social, con ámbito de actuación territorialmente limitado. Unidad de medida: Porcentaje",float,10.2,0000000000.00-9999999999.99
VI40_4_7,Familires que viven en el país : Familiares del productor que viven en México y le prestan dinero para ser utilizado en las actividades agropecuarias o forestes realizadas dentro de la unidad de producción. Unidad de medida: Porcentaje,float,10.2,0000000000.00-9999999999.99
VI40_4_8,Familiares que viven en el extranjero : Familiares del productor que viven en el extranjero y le prestan dinero para ser utilizado en las actividades agropecuarias o forestes realizadas dentro de la unidad de producción. Unidad de medida: Porcentaje,float,10.2,0000000000.00-9999999999.99
VI40_4_9,"Prestamistas : Persona física que entrega una cantidad de dinero a devolver en un plazo determinado, y recibe intereses a cambio. Unidad de medida: Porcentaje",float,10.2,0000000000.00-9999999999.99
VI40_4_10,"Otra fuente : Es cualquier tipo de institución o entidad financiera diferente a las anteriores, ésta puede ser: una Sociedad Cooperativa o de algún particular que entre sus funciones tiene la de otorgar créditos de apoyo a la producción agrícola, ganadera o forestal. Unidad de medida: Porcentaje",float,10.2,0000000000.00-9999999999.99
VI40_5_1,"Crédito de avío : Financiamiento que se otorga al productor para cubrir las necesidades de capital de trabajo, como adquisición de insumos,  materias primas, materiales, pago de jornales, salarios y otros gastos directos de la producción agrícola, ganadera o forestal, que no constituyen una inversión fija. El plazo de recuperación o amortización es, generalmente, por ciclo agrícola o máximo de dos años. Unidad de medida: Porcentaje",float,10.2,0000000000.00-9999999999.99
VI40_5_2,"Crédito refaccionario : Financiamiento que se otorga al productor para realizar inversiones fijas, tales como adquisición de: maquinaria, pie de cría, plantaciones agrícolas o forestales, entre otros proyectos de larga duración. El plazo máximo de recuperación o amortización es hasta de 15 años. Unidad de medida: Porcentaje",float,10.2,0000000000.00-9999999999.99
VI40_5_3,"Crédito de otro tipo : Es cualquier tipo de institución o entidad financiera diferente a las anteriores, ésta puede ser: una Sociedad Cooperativa o de algún particular que entre sus funciones tiene la de otorgar créditos de apoyo a la producción agrícola, ganadera o forestal. Unidad de medida: Porcentaje",float,10.2,0000000000.00-9999999999.99
UP_VI40_1_2,"Unidades de producción que solicitaron y no obtuvieron crédito : Son aquellas unidades de producción que habiendo solicitado una cantidad de dinero o insumo, para el desarrollo de sus actividades y por alguna causa no lo obtuvieron, en el periodo de referencia. Unidad de medida: Porcentaje",float,10.2,0000000000.00-9999999999.99
VI41_1,Estar en buró de crédito : Problema del productor para conseguir financiamiento de alguna institución bancaria o privada por no reunir requisitos como: aparecer en el buró de crédito. Unidad de medida: Porcentaje,float,10.2,0000000000.00-9999999999.99
VI41_2,No ser sujeto de crédito : Problema del productor para conseguir financiamiento de alguna institución bancaria o privada por no ser sujeto de crédito. Unidad de medida: Porcentaje,float,10.2,0000000000.00-9999999999.99
VI41_3,Falta de respaldo económico : Problema del productor para conseguir financiamiento de alguna institución bancaria o privada por no tener respaldo económico. Unidad de medida: Porcentaje,float,10.2,0000000000.00-9999999999.99
VI41_4,"Otra causa : Servicio suministrado por una compañía especializada que cobra a los asegurados una cantidad (prima) a cambio de una compensación determinada en el caso de que ocurra un siniestro. En el caso del sector agropecuario se trata de un contrato que los productores realizan con instituciones gubernamentales o privadas para cubrir la inversión monetaria en cultivos agrícolas, existencias ganaderas y especies forestales, en caso de pérdida total o parcial con cobertura en el periodo de referencia. Unidad de medida: Porcentaje",float,10.2,0000000000.00-9999999999.99
VI42,"Solicitaron seguro : servicio suministrado por una compañía especializada que cobra a los asegurados una cantidad (prima) a cambio de una compensación determinada en el caso de que ocurra un siniestro. En el caso del sector agropecuario se trata de un contrato que los productores realizan con instituciones gubernamentales o privadas para cubrir la inversión monetaria en cultivos agrícolas, existencias ganaderas y especies forestales, en caso de pérdida total o parcial. Unidad de medida: Porcentaje",float,10.2,0000000000.00-9999999999.99
VI42_1_1,"Si obtuvieron seguro : Servicio suministrado por una compañía especializada que cobra a los asegurados una cantidad (prima) a cambio de una compensación determinada en el caso de que ocurra un siniestro. En el caso del sector agropecuario se trata de un contrato que los productores realizan con instituciones gubernamentales o privadas para cubrir la inversión monetaria en cultivos agrícolas, existencias ganaderas y especies forestales, en caso de pérdida total o parcial. Unidad de medida: Porcentaje",float,10.2,0000000000.00-9999999999.99
VI42_1_2,"No obtuvieron seguro : Son aquellas unidades de producción que habiendo solicitado un seguro para sus cosechas o animales, por alguna causa no lo obtuvieron en el periodo de referencia.  Unidad de medida: Porcentaje",float,10.2,0000000000.00-9999999999.99
VI43_1,"No obtuvieron seguro por estar en zona de alto riesgo : Problema para el productor asociado a la baja producción causada por siniestros naturales no controlables por el hombre, que impiden el desarrollo de actividades normales en la unidad de producción en el periodo de referencia.  PROBLEMAS DE INSEGURIDAD:Problemas del productor relacionado con robo de animales o insumos, amenazas, extorción, secuestros que afectaron la productividad de la unidad de producción en el periodo de referencia. Unidad de medida: Porcentaje",float,10.2,0000000000.00-9999999999.99
VI43_2,"No obtuvieron seguro por otra causa : Hubo otra causa diferente a las mencionadas con anterioridad, por la que el productor no obtuvo el seguro para las  actividades de la unidad de producción. Unidad de medida: Porcentaje",float,10.2,0000000000.00-9999999999.99
UP_VI42,"Unidades de producción con seguro : Es un servicio suministrado por una compañía especializada que cobra a los asegurados una cantidad (prima) a cambio de una compensación determinada en el caso de que ocurra un siniestro. En el caso del sector agropecuario se trata de un contrato que los productores realizan con instituciones gubernamentales o privadas para cubrir la inversión monetaria en cultivos agrícolas, existencias ganaderas y especies forestales, en caso de pérdida total o parcial. Unidad de medida: Porcentaje",float,10.2,0000000000.00-9999999999.99
VI42_2_1,"Institución de gobierno : Aseguradora oficial que, con costos preferenciales, permite resguardar la inversión de los productores agrícolas, ganaderos o forestales, frente a situaciones adversas para la producción. Unidad de medida: Porcentaje",float,10.2,0000000000.00-9999999999.99
VI42_2_2,"Fondo de aseguramiento : Es una asociación de productores agrícolas y/o ganaderos o de personas con nacionalidad mexicana que tienen su residencia en el medio rural. Su objetivo es ofrecer protección mutualista (prestaciones mutuas) y solidaria a sus socios a través de operaciones de seguros y coaseguros (para ceder los riegos que no pueden asumir directamente) sin fines de lucro, constituidos en términos de la Ley de Fondos de Aseguramiento Agropecuario y Rural. Las coberturas que otorgan a los socios están respaldadas por sus reservas técnicas, los contratos de reaseguro que celebren y, en su caso, por los fondos de protección y de retención común de riesgos. Unidad de medida: Porcentaje",float,10.2,0000000000.00-9999999999.99
VI42_2_3,"Aseguradora privada : Aseguradora privada que, con costos preferenciales, permite resguardar la inversión de los productores agrícolas, ganaderos o forestales, frente a situaciones adversas para la producción. Unidad de medida: Porcentaje",float,10.2,0000000000.00-9999999999.99
VI42_2_4,"Otra institución : Cualquier institución diferente a la de gobierno, al fondo de aseguramiento y al aseguramiento privado que asegura la inversión del productor agrícola, ganadero o forestal ante factores adversos. Unidad de medida: Porcentaje",float,10.2,0000000000.00-9999999999.99
UP_X48,"UP_CON_PROBLEMAS_EN_EL_DESARROLLO_DE_LAS_ACTIVIDADES_AGROPECUARIAS : Son aquellas unidades de producción, que en el periodo de referencia reportaron alguna causa o inconveniente para el desarrollo adecuado de sus actividades agropecuarias: para la comercialización, para el transporte o almacenamiento de los insumos o productos, falta de capacitación o asistencia técnica, acceso al crédito, entre otros. Unidad de medida: Porcentaje",float,10.2,0000000000.00-9999999999.99
X48_1,"Problemas de acceso al crédito : Problema del productor para conseguir financiamiento de alguna institución bancaria o privada por no reunir requisitos como: falta de avales, poca superficie del terreno, aparecer en el buró de crédito, entre otras. Unidad de medida: Porcentaje",float,10.2,0000000000.00-9999999999.99
X48_2,"Problemas de pérdida de fertilidad del suelo : Problema del productor para conseguir alta productividad en la producción por la mala calidad del suelo, ya sea la falta de nutrientes, microorganismos benéficos en la capa arable o erosión del terreno, entre otros. Unidad de medida: Porcentaje",float,10.2,0000000000.00-9999999999.99
X48_3,"Problemas de pérdida por cuestiones climáticas, plagas, enfermedades, etc : Problema del productor para la producción causada por siniestros naturales no controlables por el hombre, que impiden el desarrollo de actividades normales en la unidad de producción Unidad de medida: Porcentaje",float,10.2,0000000000.00-9999999999.99
X48_4,Problemas de dificultad para la comercialización : Problema del productor para comercializar la producción causado por la sobre oferta y por los precios bajos en el mercado. Unidad de medida: Porcentaje,float,10.2,0000000000.00-9999999999.99
X48_5,"Problemas de falta de organización para la producción : Problema del productor por la falta de coordinación con otros productores para la consecución de bienes, servicios e insumos para la producción. Unidad de medida: Porcentaje",float,10.2,0000000000.00-9999999999.99
X48_6,"Problemas de infraestructura insuficiente para la producción : Problema del productor por falta de infraestructura adecuada, entendiendo ésta como el conjunto de elementos o servicios que están considerados como necesarios para que una organización pueda funcionar o bien para que una actividad se desarrolle efectivamente. Unidad de medida: Porcentaje",float,10.2,0000000000.00-9999999999.99
X48_7,"Problemas de altos costos de insumos y servicios : Problema del productor por los altos costos que se pagan por concepto de combustible, energía eléctrica, semillas, fertilizantes, mano de obra, entre otras. Unidad de medida: Porcentaje",float,10.2,0000000000.00-9999999999.99
X48_8,Problemas por falta de capacitación y asistencia tecnica : Problema del productor por no estar familiarizado con las nuevas tecnologías para realizar dichas actividades o por no recibir la asesoría de técnicos especializados en la materia. Unidad de medida: Porcentaje,float,10.2,0000000000.00-9999999999.99
X48_9,"Problemas de litigio o invasión de la tierra : Problema del productor por tener terrenos en proceso legal, a causa de pleito o discusión, problemas de linderos, por existir más de una persona que se acredita la propiedad o derecho de usufructo, embargo o expropiación. Unidad de medida: Porcentaje",float,10.2,0000000000.00-9999999999.99
X48_10,"Problemas por falta de apoyos : Problema del productor por no contar con apoyos gubernamentales como "Alianza para el campo" o "Procampo", entre otros. Unidad de medida: Porcentaje",float,10.2,0000000000.00-9999999999.99
X48_11,"Problemas por vejez, enfermedad o invalidez del productor : Problema del productor por contar con una edad avanzada, sufrir alguna enfermedad o invalidez que le impide desarrollar sus actividades productivas. Unidad de medida: Porcentaje",float,10.2,0000000000.00-9999999999.99
X48_12,"Problemas por falta de documentación para acredita la posesión de la tierra : Problema del productor por no contar con el título de propiedad, certificado agrario o la autorización de la asamblea, para el usufructo de la tierra, independientemente del régimen de tenencia a la que pertenezca la unidad de producción. Unidad de medida: Porcentaje",float,10.2,0000000000.00-9999999999.99
X48_13,"Otro tipo de problema : Problema del productor diferente a los anteriores como: la falta de carreteras, caminos de terracería, medios de transporte, trabajo fuera de la unidad, entre otros. Unidad de medida: Porcentaje",float,10.2,0000000000.00-9999999999.99
